{
  "schemaVersion": 1,
  "calculationVersion": "study-rhythm-v1",
  "generatedAt": "2026-07-29T12:00:00Z",
  "availability": "partial",
  "settings": {
    "schemaVersion": 1,
    "revision": 5,
    "enabled": true,
    "weeklyTargetDays": 3,
    "plannedRestWeekdays": [
      7
    ],
    "feedbackEnabled": true,
    "source": "stored"
  },
  "coverage": {
    "source": "activity_hub_v1",
    "scope": "all_collection",
    "today": "2026-07-29",
    "weekStart": "2026-07-27",
    "weekEnd": "2026-08-02",
    "availableFrom": "2026-07-28",
    "status": "partial",
    "knownElapsedDays": 2,
    "unavailableElapsedDates": [
      "2026-07-27"
    ]
  },
  "today": {
    "date": "2026-07-29",
    "isoWeekday": 3,
    "plan": "open",
    "activity": "inactive",
    "countsTowardTarget": false
  },
  "week": {
    "weekStart": "2026-07-27",
    "weekEnd": "2026-08-02",
    "progress": {
      "completedDays": 1,
      "targetDays": 3,
      "remainingDays": 2,
      "isLowerBound": true
    },
    "remainingOpenDays": [
      "2026-07-29",
      "2026-07-30",
      "2026-07-31",
      "2026-08-01"
    ],
    "completionState": "unknown",
    "days": [
      {
        "date": "2026-07-27",
        "isoWeekday": 1,
        "relation": "past",
        "plan": "open",
        "activity": "unavailable",
        "countsTowardTarget": null
      },
      {
        "date": "2026-07-28",
        "isoWeekday": 2,
        "relation": "past",
        "plan": "open",
        "activity": "active",
        "countsTowardTarget": true
      },
      {
        "date": "2026-07-29",
        "isoWeekday": 3,
        "relation": "today",
        "plan": "open",
        "activity": "inactive",
        "countsTowardTarget": false
      },
      {
        "date": "2026-07-30",
        "isoWeekday": 4,
        "relation": "future",
        "plan": "open",
        "activity": "future",
        "countsTowardTarget": null
      },
      {
        "date": "2026-07-31",
        "isoWeekday": 5,
        "relation": "future",
        "plan": "open",
        "activity": "future",
        "countsTowardTarget": null
      },
      {
        "date": "2026-08-01",
        "isoWeekday": 6,
        "relation": "future",
        "plan": "open",
        "activity": "future",
        "countsTowardTarget": null
      },
      {
        "date": "2026-08-02",
        "isoWeekday": 7,
        "relation": "future",
        "plan": "rest",
        "activity": "future",
        "countsTowardTarget": null
      }
    ]
  },
  "historySummary": {
    "limit": 4,
    "completedWeeks": []
  },
  "existingStreakContext": {
    "available": false,
    "currentStreak": null,
    "bestStreak": null,
    "source": "profile_study_history",
    "restAware": false
  },
  "explanations": [
    "planned_rest_is_neutral",
    "unavailable_days_are_not_missed",
    "existing_streak_is_not_rest_aware",
    "current_plan_is_not_applied_retroactively"
  ],
  "limitations": [
    "current_week_partial_coverage",
    "profile_missing_for_streak_context"
  ]
}
