{
  "schemaVersion": 1,
  "calculationVersion": "study-rhythm-v1",
  "generatedAt": "2026-07-29T12:00:00Z",
  "availability": "available",
  "settings": {
    "schemaVersion": 1,
    "revision": 0,
    "enabled": false,
    "weeklyTargetDays": 1,
    "plannedRestWeekdays": [],
    "feedbackEnabled": true,
    "source": "default"
  },
  "coverage": {
    "source": "activity_hub_v1",
    "scope": "all_collection",
    "today": "2026-07-29",
    "weekStart": "2026-07-27",
    "weekEnd": "2026-08-02",
    "availableFrom": "2026-07-01",
    "status": "full",
    "knownElapsedDays": 3,
    "unavailableElapsedDates": []
  },
  "today": null,
  "week": null,
  "historySummary": {
    "limit": 4,
    "completedWeeks": [
      {
        "weekStart": "2026-07-20",
        "weekEnd": "2026-07-26",
        "activeDays": 4
      },
      {
        "weekStart": "2026-07-13",
        "weekEnd": "2026-07-19",
        "activeDays": 3
      }
    ]
  },
  "existingStreakContext": {
    "available": true,
    "currentStreak": 1,
    "bestStreak": 14,
    "source": "profile_study_history",
    "restAware": false
  },
  "explanations": [
    "existing_streak_is_not_rest_aware"
  ],
  "limitations": []
}
